{
  "comment_id": "R1-C001",
  "revision_status": "text_ready",
  "overall_strategy": "在绪论研究贡献部分补充可直接进入正文的贡献凝练段落，并在结论部分同步呼应。",
  "actions": [
    {
      "action_id": "A1",
      "type": "insert_after_paragraph",
      "target": {
        "section_id": "sec_1",
        "section_title": "第一章 绪论",
        "page_range": "1-8",
        "asset_id": null
      },
      "anchor_text": "定位到绪论中介绍研究内容或创新点的段落之后。",
      "original_text": "原文仅描述研究背景，未集中列出贡献。",
      "new_text": "本文的主要贡献体现在以下三个方面：第一，在研究对象上，本文面向跨区域超算中心算力规划问题，将能源结构、电价差异、碳排放约束和服务质量风险纳入统一分析框架，扩展了传统算力资源调度研究的约束边界。第二，在模型构建上，本文通过多因素成本建模刻画算力任务在不同区域、不同时间和不同能源条件下的配置成本，为跨区域算力协同调度提供了可计算的优化表达。第三，在应用价值上，本文将算力资源配置与绿色低碳目标相结合，为“东数西算”和“双碳”背景下超算中心的可持续运营提供了决策支持。",
      "rationale": "该段直接回应创新贡献不够突出的意见，并给出可粘贴正文。",
      "requires_author_input": false,
      "visual_diagnosis": [],
      "redraw_spec": null,
      "caption_suggestion": null,
      "author_input_reason": null
    }
  ],
  "reviewer_response": "感谢专家意见。本文拟在绪论部分进一步凝练研究贡献，并在结论中同步呼应，以突出本文在研究对象、模型构建和应用价值方面的贡献。",
  "author_input_needed": [],
  "risks": [],
  "confidence": 0.84
}
